{
    "name": "Hello World Workload",
    "description": "An example workload",
    "domain": "bio-informatics",
    "authors": [
        "John Doe"
    ],
    "date_start": "2018-12-11T01:02:03",
    "date_end": "2018-12-11T02:03:04",
    "workflows": [
        {
            "id": "workflow-1",
            "total_cpu": 0.8,
            "total_network_usage": "10MB",
            "total_energy_usage": "100W",
            "total_memory_usage": "200MB",
            "total_disk_space_usage": "500MB",
            "ts_submit": "2018-12-11T01:02:03",
            "task_count": 2,
            "critical_path_task_count": 2,
            "approx_max_concurrent_tasks": 1,
            "tasks": [
                {
                    "id": "task-1",
                    "ts_submit": "2018-12-11T01:02:03",
                    "network_usage": "4MB",
                    "energy_usage": "90W",
                    "memory_usage": "200MB",
                    "disk_space_usage": "100MB",
                    "resources_used": [
                        {
                            "id": "machine-1",
                            "ncpu": 4,
                            "os": "Linux Debian 9.6",
                            "time_assigned": "2018-12-11T01:02:05",
                            "time_released": "2018-12-11T01:50:48",
                            "disk_space": "256GB"
                        }
                    ]
                },
                {
                    "id": "task-2",
                    "ts_submit": "2018-12-11T01:02:03",
                    "depends_on": [
                        "task-1"
                    ],
                    "network_usage": "6MB",
                    "energy_usage": "10W",
                    "memory_usage": "200MB",
                    "disk_space_usage": "400MB",
                    "data_transfers": [
                        {
                            "id": "transfer-1",
                            "size_unit": "MB",
                            "size": 100,
                            "transfer_time": "55s",
                            "ts_submit": "2018-12-11T02:00:22"
                        }
                    ],
                    "resources_used": [
                        {
                            "id": "machine-1",
                            "ncpu": 4,
                            "os": "Linux Debian 9.6",
                            "time_assigned": "2018-12-11T01:51:01",
                            "time_released": "2018-12-11T02:03:00",
                            "disk_space": "256GB"
                        }
                    ]
                }
            ]
        }
    ]
}
